[
  {
    "id": "source-a24-backrooms-film-page-2026",
    "title": "Backrooms",
    "publisher": "A24",
    "creator": null,
    "publishedDate": null,
    "accessedDate": "2026-07-05",
    "url": "https://a24films.com/films/backrooms",
    "archiveUrl": null,
    "sourceType": "studio-statement",
    "sourceTier": "primary",
    "format": "official-film-page",
    "availability": "public",
    "notes": "Official A24 film listing identifying Kane Parsons as director and Will Soodik as writer.",
    "verified": true
  },
  {
    "id": "source-box-office-mojo-backrooms-2026",
    "title": "Backrooms (2026) — title summary",
    "publisher": "Box Office Mojo",
    "creator": null,
    "publishedDate": null,
    "accessedDate": "2026-07-05",
    "url": "https://www.boxofficemojo.com/title/tt26657236/",
    "archiveUrl": null,
    "sourceType": "box-office-data",
    "sourceTier": "authoritative-secondary",
    "format": "database",
    "availability": "public",
    "notes": "Dynamic title page. The cumulative total must always be quoted with an access date because it changes during the theatrical run.",
    "verified": true
  },
  {
    "id": "source-variety-backrooms-300m-2026-06-21",
    "title": "Toy Story 5 box-office weekend report",
    "publisher": "Variety",
    "creator": null,
    "publishedDate": "2026-06-21",
    "accessedDate": "2026-07-05",
    "url": "https://variety.com/2026/film/box-office/toy-story-5-box-office-opening-weekend-record-franchise-1236786574/",
    "archiveUrl": null,
    "sourceType": "box-office-data",
    "sourceTier": "authoritative-secondary",
    "format": "article",
    "availability": "public-partial",
    "notes": "Reported Backrooms at approximately $301 million worldwide on June 21 and identified it as A24's first release above $300 million globally.",
    "verified": true
  },
  {
    "id": "source-deepmind-a24-partnership-2026-06-22",
    "title": "Google DeepMind and A24 announce first-of-its-kind research partnership",
    "publisher": "Google DeepMind",
    "creator": "Eli Collins",
    "publishedDate": "2026-06-22",
    "accessedDate": "2026-07-05",
    "url": "https://deepmind.google/blog/google-deepmind-and-a24-announce-first-of-its-kind-research-partnership/",
    "archiveUrl": null,
    "sourceType": "corporate-statement",
    "sourceTier": "primary",
    "format": "official-announcement",
    "availability": "public",
    "notes": "Confirms a research partnership intended to develop workflows and techniques with filmmakers. It does not identify Backrooms or any other specific production.",
    "verified": true
  },
  {
    "id": "source-reuters-a24-deepmind-2026-06-22",
    "title": "Google DeepMind signs AI research deal with film studio A24",
    "publisher": "Reuters",
    "creator": "Anhata Rooprai and Dawn Chmielewski",
    "publishedDate": "2026-06-22",
    "accessedDate": "2026-07-05",
    "url": "https://www.reuters.com/business/media-telecom/google-deepmind-signs-ai-research-deal-with-film-studio-a24-2026-06-22/",
    "archiveUrl": null,
    "sourceType": "trade-report",
    "sourceTier": "authoritative-secondary",
    "format": "article",
    "availability": "public",
    "notes": "Confirms the partnership and attributes the approximately $75 million figure to The Wall Street Journal; DeepMind did not confirm the amount to Reuters.",
    "verified": true
  },
  {
    "id": "source-wsj-a24-google-investment-2026-06-22",
    "title": "Google Investing in ‘Backrooms’ Studio A24 as Part of New AI Research Partnership",
    "publisher": "The Wall Street Journal",
    "creator": "Ben Fritz",
    "publishedDate": "2026-06-22",
    "accessedDate": "2026-07-05",
    "url": "https://www.wsj.com/tech/ai/google-investing-in-backrooms-studio-a24-e7585ebe",
    "archiveUrl": null,
    "sourceType": "trade-report",
    "sourceTier": "authoritative-secondary",
    "format": "article",
    "availability": "metered",
    "notes": "Reports that Google is investing around $75 million in A24 and that the companies intend to develop tools for film production and distribution.",
    "verified": true
  },
  {
    "id": "source-deadline-backrooms-sequel-2026-06-01",
    "title": "‘Backrooms’: Here’s The Current State Of A Sequel For Kane Parsons",
    "publisher": "Deadline",
    "creator": null,
    "publishedDate": "2026-06-01",
    "accessedDate": "2026-07-05",
    "url": "https://deadline.com/2026/06/backrooms-sequel-kane-parsons-1236938378/",
    "archiveUrl": null,
    "sourceType": "trade-report",
    "sourceTier": "authoritative-secondary",
    "format": "article",
    "availability": "public-partial",
    "notes": "Reports a sequel in early development and says Parsons was seeking a screenwriting collaborator. This is not a release commitment or production-start confirmation.",
    "verified": true
  },
  {
    "id": "source-kyle-buchanan-portal-post-2026-06-05",
    "title": "Post describing Kane Parsons' exploratory interest in a Portal film",
    "publisher": "X",
    "creator": "Kyle Buchanan",
    "publishedDate": "2026-06-05",
    "accessedDate": "2026-07-05",
    "url": "https://x.com/kylebuchanan/status/2062691515252789477",
    "archiveUrl": null,
    "sourceType": "social-post",
    "sourceTier": "primary",
    "format": "post",
    "availability": "public",
    "notes": "Buchanan says he asked Parsons in early May about directing Portal and reports Parsons was already looking into it with caution and curiosity. This establishes exploratory interest, not a commissioned project.",
    "verified": true
  },
  {
    "id": "source-gamesradar-valve-visit-2026-06-26",
    "title": "Backrooms director Kane Parsons has visited Valve, and the chances of a Portal movie happening just shot up",
    "publisher": "GamesRadar+",
    "creator": "Fay Watson",
    "publishedDate": "2026-06-26",
    "accessedDate": "2026-07-05",
    "url": "https://www.gamesradar.com/entertainment/horror-movies/backrooms-director-kane-parsons-has-visited-valve-and-the-chances-of-a-portal-movie-happening-just-shot-up/",
    "archiveUrl": null,
    "sourceType": "secondary-report",
    "sourceTier": "secondary",
    "format": "article",
    "availability": "public",
    "notes": "Documents Instagram Story images from Valve headquarters. Neither the purpose of the visit nor a Portal production was confirmed.",
    "verified": true
  },
  {
    "id": "source-siff-everything-must-go-2026-07-03",
    "title": "Backrooms: Everything Must Go Edition w/ Extra Footage",
    "publisher": "SIFF Cinema",
    "creator": null,
    "publishedDate": null,
    "accessedDate": "2026-07-05",
    "url": "https://www.siff.net/cinema/in-theaters/backrooms-everything-must-go-edition-w/-extra-footage",
    "archiveUrl": null,
    "sourceType": "theatrical-listing",
    "sourceTier": "authoritative-secondary",
    "format": "listing",
    "availability": "public",
    "notes": "Lists a July 3, 2026 opening, a 126-minute runtime, and 15 minutes of new theatrically exclusive post-credit footage.",
    "verified": true
  },
  {
    "id": "source-ap-backrooms-pvod-2026-07-03",
    "title": "What to Stream: Rolling Stones, ‘Little House on the Prairie’ and ‘Backrooms’",
    "publisher": "Associated Press",
    "creator": "The Associated Press",
    "publishedDate": "2026-07-03",
    "accessedDate": "2026-07-06",
    "url": "https://apnews.com/article/46cad3b80b00ca53d8b9e09fbc35f1e0",
    "archiveUrl": null,
    "sourceType": "release-calendar",
    "sourceTier": "authoritative-secondary",
    "format": "article",
    "availability": "public",
    "notes": "Reports that Backrooms makes its premium video-on-demand debut on July 7, 2026, available for purchase on major streaming services. Does not state whether the Everything Must Go bonus footage is included.",
    "verified": true
  },
  {
    "id": "source-backroomsmovie-japan-2026-06-28",
    "title": "Japanese Backrooms Trailer and Release Date",
    "publisher": "The Backrooms Online",
    "creator": null,
    "publishedDate": "2026-06-28",
    "accessedDate": "2026-07-05",
    "url": "https://backroomsmovie.com/2026/06/japanese-backrooms-trailer-and-release-date/",
    "archiveUrl": null,
    "sourceType": "fan-report",
    "sourceTier": "community",
    "format": "article",
    "availability": "public",
    "notes": "Community report that surfaced the September 4 Japanese release before the official distributor page was added to the archive.",
    "verified": true
  },
  {
    "id": "source-a24-happinet-backrooms-japan-page-2026-07-06",
    "title": "Backrooms",
    "publisher": "A24×Happinet Phantom Studios",
    "creator": null,
    "publishedDate": null,
    "accessedDate": "2026-07-06",
    "url": "https://a24jp.com/films/backrooms/",
    "archiveUrl": null,
    "sourceType": "official-film-page",
    "sourceTier": "primary",
    "format": "film-listing",
    "availability": "public",
    "notes": "Official Japanese distributor page listing a September 4, 2026 release date and identifying Kane Parsons as director.",
    "verified": true
  },
  {
    "id": "source-deadline-kane-ai-2026-06-03",
    "title": "‘Backrooms’ Director Kane Parsons Calls AI ‘Genuinely Harmful’ To Creativity",
    "publisher": "Deadline",
    "creator": null,
    "publishedDate": "2026-06-03",
    "accessedDate": "2026-07-05",
    "url": "https://deadline.com/2026/06/backrooms-kane-parsons-calls-ai-genuinely-harmful-1236940532/",
    "archiveUrl": null,
    "sourceType": "interview-report",
    "sourceTier": "authoritative-secondary",
    "format": "article",
    "availability": "public-partial",
    "notes": "Reports Parsons' criticism of generative AI in creative work from an interview with The Australian.",
    "verified": true
  },
  {
    "id": "source-kotaku-kane-ai-scope-2026-06-27",
    "title": "A24’s Bad Excuse For Its Controversial Google AI Partnership Isn’t Impressing Fans",
    "publisher": "Kotaku",
    "creator": "Lewis Parker",
    "publishedDate": "2026-06-27",